<?xml version="1.0" encoding="UTF-8"?>
<!DOCTYPE MLW-test SYSTEM "../DTD/MLW-DTD_2017-07-12.dtd">
<MLW-test>
    <artikel xml:id="facitergula">
        <!-- Lemma-Ansatz -->
        <!-- nur ein Lemma  -->
        <lemma-position>
            <lemma klassisch="nein" gesichert="nein">facitergula</lemma>
            <!-- Lemmavarianten -->
            <lemma-varianten>
                <lemma-variante kurz="fasc-">fascitergula</lemma-variante>
                <lemma-variante kurz="-iet-">facietergula</lemma-variante>
                <lemma-variante kurz="-ist-">facistergula</lemma-variante>
                <lemma-variante kurz="-rcu-">facitercula</lemma-variante>
                <zusatz typ="sim"></zusatz>
            <lemma-varianten>
            <!-- Grammatik            -->
            <grammatik-position>
                <!-- Grammatik fürs Lemma                 -->
                <grammatik wortart="nomen" genus="f" klasse="a-ae">-ae</grammatik>
                <!-- Grammatik für die Varianten                -->
                <grammatik-varianten>
                    <grammatik-variante>
                        <grammatik wortart="nomen" genus="m" klasse="us-i">-us, -i</grammatik>
                        <beleg id="facitergula-001">
                            <verweis typ="beleg" ziel="facitergula_003"></verweis>
                            <!-- l. 8 -->
                        </beleg>
                    </grammatik-variante>
                    <grammatik-variante>
                        <grammatik wortart="nomen" genus="m" klasse="um-i">-um, -i</grammatik>
                        <beleg id="facitergula-beleg002">
                            <verweis typ="beleg" ziel="facitergula_002"></verweis>
                            <!-- l. 6.11 = Mehrfachverweis -->
                        </beleg>
                        <beleg id="facitergula-beleg002b">
                            <verweis typ="beleg" ziel="facitergula_008"></verweis>
                            <!-- l. 6.11 = Mehrfachverweis -->
                        </beleg>
                    </grammatik-variante>
                </grammatik-varianten>
            </grammatik-position>
            <!-- Etymologie-Position: hier nicht vorhanden         -->
        </lemma-position>
        <!--  Artikelkopf -->
        <artikelkopf>
            <!-- Schreibweisen des Lemmas            -->
            <schreibweisen-position>
                <schreibweisen-variante>
                    <schreibweise-besonderheit typ="script"></schreibweise-besonderheit>
                    <!--wenn nur eine Schreibweise, dann nach "script." KEIN Doppelpunkt, sonst schon!-->
                    <schreibweise>vizreg-</schreibweise>
                    <beleg id="facitergula-beleg003">
                        <verweis typ="beleg" ziel="facitergula_013"></verweis>
                    </beleg>
                </schreibweisen-variante>
                <schreibweisen-variante>
                    <schreibweise-besonderheit typ="script"></schreibweise-besonderheit>
                    <schreibweise>festregel(a)</schreibweise>
                    <beleg id="facitergula-beleg004">
                        <verweis typ="beleg" ziel="facitergula_010"></verweis>
                    </beleg>
                </schreibweisen-variante>
                <schreibweisen-variante>
                    <schreibweise-besonderheit typ="script"></schreibweise-besonderheit>
                    <schreibweise>fezdregl(a)</schreibweise>
                    <beleg id="facitergula-beleg005">
                        <verweis typ="beleg" ziel="facitergula_008"></verweis>
                    </beleg>
                </schreibweisen-variante>
            </schreibweisen-position>
        </artikelkopf>
        <!-- Hauptteil -->
        <bedeutung-position>
            <!-- nur eine Bedeutungsposition in jedem Artikel -->
            <!-- 1. Bedeutung -->
            <bedeutung nr="1">
                <interpretament typ="lat">pannus, faciale, sudarium</interpretament>
                <interpretament-deutsch>(Gesichts-, Schweiß-)Tuch</interpretament-deutsch>
                <interpretament-zusatz>usu liturg.</interpretament-zusatz>
                <interpretament-zusatz>de re v.                     
                    <verweis typ="beleg" ziel="???"></verweis>p. 32,63
                
                </interpretament-zusatz>
                <!--                Belege für die 1. Bedeutung -->
                <beleg-position>
                    <!--                    Beleg 1 -->
                    <beleg id="facitergula_beleg001">
                        <beleg-quelle>
                            <autor>Catal.</autor>
                            <werk>thes. Germ.</werk>
                            <stelle>28,11</stelle>
                            <datierung>Post 851</datierung>
                        </beleg-quelle>
                        <beleg-text>
                            <lemma-beleg kurzform="-um">facitergulum</lemma-beleg> Ill.
                        
                        </beleg-text>
                    </beleg>
                    <!--                    Beleg 2 -->
                    <beleg id="facitergula_beleg002">
                        <beleg-quelle>
                            <autor>Form.</autor>
                            <werk>Sangall.</werk>
                            <stelle>39 p. 421,16</stelle>
                        </beleg-quelle>
                        <beleg-text>munuscula ... direximus, hoc est palliolum ...,                             
                            <lemma-beleg kurzform="-as">facitergulas</lemma-beleg> duas.
                        
                        </beleg-text>
                    </beleg>
                    <!--                    Beleg 3 -->
                    <beleg id="facitergula_beleg003">
                        <beleg-quelle>
                            <autor>Catal.</autor>
                            <werk>thes. Germ.</werk>
                            <stelle>18,7</stelle>
                        </beleg-quelle>
                        <beleg-text>
                            <lemma-beleg kurzform="-eterculi">faciterculi</lemma-beleg> viginti quatuor.
                        
                        </beleg-text>
                    </beleg>
                    <!--                    Beleg 4 -->
                    <beleg id="facitergula_beleg004">
                        <beleg-quelle>
                            <autor>Libri</autor>
                            <werk>confrat. I</werk>
                            <stelle>app. A 6 p. 137,30</stelle>
                        </beleg-quelle>
                        <beleg-text>pulpitum ...                             
                            <lemma-beleg kurzform="-a">facitergula</lemma-beleg> cocco imaginata circumdari iussit                             
                            <redaktion-ergaenzung>pontifex</redaktion-ergaenzung>.
                        
                        </beleg-text>
                    </beleg>
                    <!--                    Beleg 5 -->
                    <beleg id="facitergula_beleg005">
                        <beleg-quelle>
                            <autor>Catal.</autor>
                            <werk>thes. Germ.</werk>
                            <stelle>76,15</stelle>
                        </beleg-quelle>
                        <beleg-text>
                            <lemma-beleg kurzform="-rulae">faciterulae</lemma-beleg> Il.
                        
                        </beleg-text>
                    </beleg>
                    <!--                    Beleg 6 -->
                    <beleg id="facitergula_beleg013">
                        <beleg-quelle>
                            <autor>Catal.</autor>
                            <werk>thes. Germ.</werk>
                            <stelle>40,5 VI</stelle>
                        </beleg-quelle>
                        <beleg-text>
                            <lemma-beleg>vizregule</lemma-beleg>.
                        
                        </beleg-text>
                    </beleg>
                    <!--                    Beleg 7 -->
                    <beleg id="facitergula_beleg006">
                        <beleg-quelle>
                            <autor>Catal.</autor>
                            <werk>thes. Germ.</werk>
                            <stelle>129
                                
                                <hoch>a</hoch>,5
                            
                            </stelle>
                        </beleg-quelle>
                        <beleg-text>
                            <lemma-beleg kurzform="-sterculas">facisterculas</lemma-beleg> Il.
                        
                        </beleg-text>
                    </beleg>
                    <!--                    Beleg 8 -->
                    <beleg id="facitergula_beleg007">
                        <beleg-quelle>
                            <autor>Catal.</autor>
                            <werk>thes. Germ.</werk>
                            <stelle>24,8</stelle>
                        </beleg-quelle>
                        <beleg-text>
                            <lemma-beleg kurzform="-itella">facitella</lemma-beleg> X.
                        
                        </beleg-text>
                    </beleg>
                    <!--                    Beleg 9 -->
                    <beleg id="facitergula_beleg008">
                        <beleg-quelle>
                            <autor>Catal.</autor>
                            <werk>thes. Germ.</werk>
                            <stelle>114,8</stelle>
                        </beleg-quelle>
                        <beleg-text>VIII                             
                            <lemma-beleg>fezdregle</lemma-beleg>.